{
  "$schema": "https://json-schema.org/draft/2020-12/schema",
  "$id": "teleological-physics-registry-validation.v1.0.0",
  "type": "object",
  "additionalProperties": false,
  "required": ["schemaVersion", "registryId", "registryVersion", "verdict", "checksPassed", "checksFailed", "checks", "reportFingerprint"],
  "properties": {
    "schemaVersion": { "const": "teleological-physics-registry-validation.v1.0.0" },
    "registryId": { "const": "teleological_physics_registry" },
    "registryVersion": { "const": "1.0.0" },
    "verdict": { "enum": ["PASS", "FAIL"] },
    "checksPassed": { "type": "integer", "minimum": 0 },
    "checksFailed": { "type": "integer", "minimum": 0 },
    "checks": {
      "type": "array",
      "minItems": 15,
      "maxItems": 15,
      "uniqueItems": true,
      "items": {
        "type": "object",
        "additionalProperties": false,
        "required": ["checkId", "diagnostic", "evidenceLocator", "expected", "actual", "status"],
        "properties": {
          "checkId": { "type": "string", "minLength": 1 },
          "diagnostic": {},
          "evidenceLocator": { "type": "string", "minLength": 1 },
          "expected": {},
          "actual": {},
          "status": { "enum": ["PASS", "FAIL"] }
        }
      }
    },
    "reportFingerprint": { "type": "string", "pattern": "^[0-9a-f]{64}$" }
  }
}
